<?xml version="1.0" encoding="UTF-8"?>
<root xmlns:xsi="http://www.w3.org/2001/XMLSchema-instance" xsi:noNamespaceSchemaLocation="model.xsd">
  <concessionnaire>
    <siren>siren</siren>
  </concessionnaire>
  <vehicule>
    <marque>marque</marque>
    <modele>modele</modele>
    <couleur>couleur</couleur>
    <nb_portes>0</nb_portes>
    <nb_places>0</nb_places>
    <equipement>equipement</equipement>
    <motorisation>motorisation</motorisation>
    <emission>0</emission>
    <url>url</url>
    <prix>0</prix>
  </vehicule>
   <vehicule>
    <marque>marque1</marque>
    <modele>modele1</modele>
    <couleur>couleur1</couleur>
    <nb_portes>01</nb_portes>
    <nb_places>01</nb_places>
    <equipement>equipement1</equipement>
    <motorisation>motorisation1</motorisation>
    <emission>01</emission>
    <url>url1</url>
    <prix>01</prix>
  </vehicule>
</root>
