<?xml version="1.0" encoding="UTF-8"?>
<root xmlns:xsi="http://www.w3.org/2001/XMLSchema-instance" xsi:noNamespaceSchemaLocation="model.xsd">
  <concessionnaire>
    <siren>siren</siren>
  </concessionnaire>
  <vehicule>
    <marque>peugot</marque>
    <modele>206</modele>
    <couleur>noir</couleur>
    <nb_portes>3</nb_portes>
    <nb_places>5</nb_places>
    <equipement></equipement>
    <motorisation></motorisation>
    <emission>0</emission>
    <url>http://www.car-luxury-agency.com/blog/wp-content/uploads/2012/03/Audi-R8-Spyder-100x100.jpg</url>
    <prix>4000</prix>
  </vehicule>
</root>
